[
  {
    "sos_id": "sos-0001",
    "run_id": "replay-michaung",
    "reporter_id": "install-demo-2",
    "created_at": "2023-12-04T01:55:00+05:30",
    "location": {
      "lat": 12.9730212,
      "lon": 80.2164186
    },
    "people_count": 3,
    "flags": {
      "elderly": true,
      "child": false,
      "medical": false
    },
    "photo_key": null
  }
]
